{
  "schema_version": "pywel.patch.v1",
  "patch_id": "pat_01jzcdversion10900000001",
  "game_id": "crimson_desert",
  "version": "1.09.00",
  "released_at": "2026-05-29T06:20:00Z",
  "platforms": [
    "all"
  ],
  "source_evidence_ids": [
    "evd_01jzcdpatch109official001"
  ],
  "affected_entity_ids": [
    "ent_01jzcdcontrols00000000001",
    "ent_01jzcdfarming000000000001",
    "ent_01jzcdmagicscythe00000001",
    "ent_85cd231cab36c18c98ca5c2c"
  ],
  "content_coverage": {
    "level": "partial",
    "normalized_claim_count": 4,
    "notes": "Finite M1 selection of independently bounded facts and official source locators. Patch-note prose, bulk change records, and full-note completeness reviews are excluded; complete note or observed gameplay coverage is not claimed."
  },
  "revision": 2,
  "provenance": {
    "created_at": "2026-07-14T00:00:00-05:00",
    "created_by": "seed_import_v1",
    "source_receipt_id": "rcp_m1publicscope202609100001",
    "updated_at": "2026-07-15T03:45:18-05:00"
  }
}
